{
  "schemaVersion": 1,
  "fixtureId": "m2-022-linux-client-clipboard-keepalive",
  "protocol": "barrier",
  "provenance": {
    "sourceKind": "black-box-capture",
    "reference": "Controlled black-box observation (evidence/e2e/M2-022/tools/capture_client_clipboard_keepalive.py) on the owner-approved Ubuntu 22.04 x86_64 host: barriers and barrierc 2.4.0-release, protocol 1.6, on separate Xvfb displays through a byte-logging loopback relay, TLS disabled for the observation only. Client copy with xclip, keepalive until the client closed. The whole client-to-server DCLP body after the code is zero-filled. Details: evidence/e2e/M2-022/README.md; register entry BARRIER-EVID-0007."
  },
  "payload": {
    "path": "client-clipboard-keepalive-capture.json",
    "sha256": "72417873132f738a9e256ee73365d09a36c681a59175e010f7be46989d615bb7",
    "byteLength": 4878
  },
  "sanitization": {
    "status": "sanitized",
    "containsSensitiveData": false,
    "removedCategories": [
      "ip-address",
      "clipboard-payload"
    ]
  }
}
