{
  "schemaVersion": 1,
  "fixtureId": "m2-022-linux-punctuation-clipboard",
  "protocol": "barrier",
  "provenance": {
    "sourceKind": "black-box-capture",
    "reference": "Controlled black-box observation (evidence/e2e/M2-022/tools/capture_punctuation_clipboard.py) on the owner-approved Ubuntu 22.04 x86_64 host: barriers and barrierc 2.4.0-release, protocol 1.6, on separate Xvfb displays through a byte-logging loopback relay, TLS disabled for the observation only. Synthetic xdotool and xclip input. Every clipboard format content is zero-filled. Details: evidence/e2e/M2-022/punctuation-clipboard.md; register entry BARRIER-EVID-0008."
  },
  "payload": {
    "path": "punctuation-clipboard-capture.json",
    "sha256": "3851b910daa68b30631418c4f26e3fc1f0569c28827c23f48304cf9ccbfcb41f",
    "byteLength": 23530
  },
  "sanitization": {
    "status": "sanitized",
    "containsSensitiveData": false,
    "removedCategories": [
      "ip-address",
      "clipboard-payload"
    ]
  }
}
